{
  "pdf_path": "projects/PROJ-635-evalverse-pipeline-aware-and-expert-cali/paper/pdf/main-llmxive.pdf",
  "paper_id": "PROJ-635-evalverse-pipeline-aware-and-expert-cali",
  "audited_at": "2026-08-06T13:48:07Z",
  "total_pages": 24,
  "pages": [
    {
      "page": 1,
      "status": "pass",
      "failures": []
    },
    {
      "page": 2,
      "status": "pass",
      "failures": []
    },
    {
      "page": 3,
      "status": "pass",
      "failures": []
    },
    {
      "page": 4,
      "status": "pass",
      "failures": []
    },
    {
      "page": 5,
      "status": "pass",
      "failures": []
    },
    {
      "page": 6,
      "status": "pass",
      "failures": []
    },
    {
      "page": 7,
      "status": "pass",
      "failures": []
    },
    {
      "page": 8,
      "status": "pass",
      "failures": []
    },
    {
      "page": 9,
      "status": "pass",
      "failures": []
    },
    {
      "page": 10,
      "status": "pass",
      "failures": []
    },
    {
      "page": 11,
      "status": "pass",
      "failures": []
    },
    {
      "page": 12,
      "status": "pass",
      "failures": []
    },
    {
      "page": 13,
      "status": "pass",
      "failures": []
    },
    {
      "page": 14,
      "status": "pass",
      "failures": []
    },
    {
      "page": 15,
      "status": "pass",
      "failures": []
    },
    {
      "page": 16,
      "status": "pass",
      "failures": []
    },
    {
      "page": 17,
      "status": "pass",
      "failures": []
    },
    {
      "page": 18,
      "status": "pass",
      "failures": []
    },
    {
      "page": 19,
      "status": "pass",
      "failures": []
    },
    {
      "page": 20,
      "status": "pass",
      "failures": []
    },
    {
      "page": 21,
      "status": "pass",
      "failures": []
    },
    {
      "page": 22,
      "status": "pass",
      "failures": []
    },
    {
      "page": 23,
      "status": "pass",
      "failures": []
    },
    {
      "page": 24,
      "status": "fail",
      "failures": [
        {
          "kind": "section_number_gap",
          "evidence": "expected section 9, saw section 196",
          "class": "unsupported_construct",
          "recommendation": "check for stray \\setcounter or \\section* in source"
        }
      ]
    }
  ],
  "summary": {
    "total_failures": 1,
    "failure_classes": {
      "source_fixable": 0,
      "unsupported_construct": 1,
      "source_missing": 0,
      "audit_tool_crash": 0
    },
    "passed_pages": 23,
    "failed_pages": 1
  }
}