{
  "pdf_path": "projects/PROJ-626-skillopt-executive-strategy-for-self-evo/paper/pdf/main-llmxive.pdf",
  "paper_id": "PROJ-626-skillopt-executive-strategy-for-self-evo",
  "audited_at": "2026-09-26T22:17:00Z",
  "total_pages": 33,
  "pages": [
    {
      "page": 1,
      "status": "pass",
      "failures": []
    },
    {
      "page": 2,
      "status": "pass",
      "failures": []
    },
    {
      "page": 3,
      "status": "pass",
      "failures": []
    },
    {
      "page": 4,
      "status": "pass",
      "failures": []
    },
    {
      "page": 5,
      "status": "pass",
      "failures": []
    },
    {
      "page": 6,
      "status": "pass",
      "failures": []
    },
    {
      "page": 7,
      "status": "pass",
      "failures": []
    },
    {
      "page": 8,
      "status": "pass",
      "failures": []
    },
    {
      "page": 9,
      "status": "pass",
      "failures": []
    },
    {
      "page": 10,
      "status": "pass",
      "failures": []
    },
    {
      "page": 11,
      "status": "pass",
      "failures": []
    },
    {
      "page": 12,
      "status": "pass",
      "failures": []
    },
    {
      "page": 13,
      "status": "pass",
      "failures": []
    },
    {
      "page": 14,
      "status": "pass",
      "failures": []
    },
    {
      "page": 15,
      "status": "pass",
      "failures": []
    },
    {
      "page": 16,
      "status": "pass",
      "failures": []
    },
    {
      "page": 17,
      "status": "pass",
      "failures": []
    },
    {
      "page": 18,
      "status": "pass",
      "failures": []
    },
    {
      "page": 19,
      "status": "pass",
      "failures": []
    },
    {
      "page": 20,
      "status": "pass",
      "failures": []
    },
    {
      "page": 21,
      "status": "pass",
      "failures": []
    },
    {
      "page": 22,
      "status": "pass",
      "failures": []
    },
    {
      "page": 23,
      "status": "pass",
      "failures": []
    },
    {
      "page": 24,
      "status": "pass",
      "failures": []
    },
    {
      "page": 25,
      "status": "pass",
      "failures": []
    },
    {
      "page": 26,
      "status": "pass",
      "failures": []
    },
    {
      "page": 27,
      "status": "pass",
      "failures": []
    },
    {
      "page": 28,
      "status": "pass",
      "failures": []
    },
    {
      "page": 29,
      "status": "pass",
      "failures": []
    },
    {
      "page": 30,
      "status": "pass",
      "failures": []
    },
    {
      "page": 31,
      "status": "pass",
      "failures": []
    },
    {
      "page": 32,
      "status": "pass",
      "failures": []
    },
    {
      "page": 33,
      "status": "pass",
      "failures": []
    }
  ],
  "summary": {
    "total_failures": 0,
    "failure_classes": {
      "source_fixable": 0,
      "unsupported_construct": 0,
      "source_missing": 0,
      "audit_tool_crash": 0
    },
    "passed_pages": 33,
    "failed_pages": 0
  }
}